{
  "schema_version": "1.0.0",
  "project_id": "remake_campaign_001",
  "artifact_id": "storyboard_manifest",
  "created_at": "2026-06-27T11:21:08.766657Z",
  "source_artifacts": [
    "storyboard_prompts.json"
  ],
  "model_info": {
    "provider": "dry-run",
    "model": "deterministic-fixture",
    "temperature": 0.0
  },
  "cost_rmb": 0.0,
  "storyboards": [
    {
      "new_shot_id": "new_001",
      "image_id": "sb_001",
      "image_path": "output/storyboards/sb_001.png",
      "model": "flux-2-pro",
      "source_prompt_id": "new_001",
      "selected": true
    },
    {
      "new_shot_id": "new_002",
      "image_id": "sb_002",
      "image_path": "output/storyboards/sb_002.png",
      "model": "flux-2-klein",
      "source_prompt_id": "new_002",
      "selected": true
    },
    {
      "new_shot_id": "new_003",
      "image_id": "sb_003",
      "image_path": "output/storyboards/sb_003.png",
      "model": "flux-2-klein",
      "source_prompt_id": "new_003",
      "selected": true
    },
    {
      "new_shot_id": "new_004",
      "image_id": "sb_004",
      "image_path": "output/storyboards/sb_004.png",
      "model": "flux-2-klein",
      "source_prompt_id": "new_004",
      "selected": true
    },
    {
      "new_shot_id": "new_005",
      "image_id": "sb_005",
      "image_path": "output/storyboards/sb_005.png",
      "model": "flux-2-klein",
      "source_prompt_id": "new_005",
      "selected": true
    },
    {
      "new_shot_id": "new_006",
      "image_id": "sb_006",
      "image_path": "output/storyboards/sb_006.png",
      "model": "flux-2-klein",
      "source_prompt_id": "new_006",
      "selected": true
    },
    {
      "new_shot_id": "new_007",
      "image_id": "sb_007",
      "image_path": "output/storyboards/sb_007.png",
      "model": "flux-2-pro",
      "source_prompt_id": "new_007",
      "selected": true
    },
    {
      "new_shot_id": "new_008",
      "image_id": "sb_008",
      "image_path": "output/storyboards/sb_008.png",
      "model": "flux-2-pro",
      "source_prompt_id": "new_008",
      "selected": true
    },
    {
      "new_shot_id": "new_009",
      "image_id": "sb_009",
      "image_path": "output/storyboards/sb_009.png",
      "model": "flux-2-pro",
      "source_prompt_id": "new_009",
      "selected": true
    },
    {
      "new_shot_id": "new_010",
      "image_id": "sb_010",
      "image_path": "output/storyboards/sb_010.png",
      "model": "flux-2-pro",
      "source_prompt_id": "new_010",
      "selected": true
    },
    {
      "new_shot_id": "new_011",
      "image_id": "sb_011",
      "image_path": "output/storyboards/sb_011.png",
      "model": "flux-2-pro",
      "source_prompt_id": "new_011",
      "selected": true
    },
    {
      "new_shot_id": "new_012",
      "image_id": "sb_012",
      "image_path": "output/storyboards/sb_012.png",
      "model": "flux-2-pro",
      "source_prompt_id": "new_012",
      "selected": true
    },
    {
      "new_shot_id": "new_013",
      "image_id": "sb_013",
      "image_path": "output/storyboards/sb_013.png",
      "model": "flux-2-pro",
      "source_prompt_id": "new_013",
      "selected": true
    },
    {
      "new_shot_id": "new_014",
      "image_id": "sb_014",
      "image_path": "output/storyboards/sb_014.png",
      "model": "flux-2-pro",
      "source_prompt_id": "new_014",
      "selected": true
    },
    {
      "new_shot_id": "new_015",
      "image_id": "sb_015",
      "image_path": "output/storyboards/sb_015.png",
      "model": "flux-2-pro",
      "source_prompt_id": "new_015",
      "selected": true
    },
    {
      "new_shot_id": "new_016",
      "image_id": "sb_016",
      "image_path": "output/storyboards/sb_016.png",
      "model": "flux-2-klein",
      "source_prompt_id": "new_016",
      "selected": true
    },
    {
      "new_shot_id": "new_017",
      "image_id": "sb_017",
      "image_path": "output/storyboards/sb_017.png",
      "model": "flux-2-klein",
      "source_prompt_id": "new_017",
      "selected": true
    },
    {
      "new_shot_id": "new_018",
      "image_id": "sb_018",
      "image_path": "output/storyboards/sb_018.png",
      "model": "flux-2-klein",
      "source_prompt_id": "new_018",
      "selected": true
    },
    {
      "new_shot_id": "new_019",
      "image_id": "sb_019",
      "image_path": "output/storyboards/sb_019.png",
      "model": "flux-2-klein",
      "source_prompt_id": "new_019",
      "selected": true
    },
    {
      "new_shot_id": "new_020",
      "image_id": "sb_020",
      "image_path": "output/storyboards/sb_020.png",
      "model": "flux-2-pro",
      "source_prompt_id": "new_020",
      "selected": true
    }
  ]
}
